{
  "schema_version": "1.0",
  "manifest_id": "cid:example_manifest_sha256_001",
  "created_at": "2025-12-24T00:00:00.000Z",
  "created_by": "Eva Lerner-Lam (template build)",
  "hash_algorithm": "sha256",
  "canonicalization": "sorted-keys-minified",
  "objects": [
    {
      "object_id": "cid:governance_0001",
      "object_type": "governance_policy",
      "title": "Draft IT Stewardship Principles for a Professional Society",
      "summary": "Starter principles for stewardship, transparency, and member trust.",
      "keywords": [
        "stewardship",
        "governance",
        "ITs",
        "ASCE"
      ],
      "source": {
        "provenance": "Template object authored for internal prototyping.",
        "author": "Eva Lerner-Lam",
        "organization": "(not ASCE)",
        "published_date": "2025-12-24",
        "license": "Internal template"
      },
      "content_hash": "sha256:examplehash_governance_0001",
      "content_path": "03_object_store_template/governance/governance_0001_it_stewardship.json",
      "metadata": {
        "verification_tier": "draft"
      }
    }
  ]
}